,Facts,Cluster,x0,x1
0,lives kragujevac relevant time journalist editorinchief svetlost weekly news magazine based town represented rakićević practising kragujevac represented agent jadrijević mladar facts submitted summarised published articles svetlost published titled shame silence ćutanjem crvenila piece written far relevant reads kragujevac reason ashamed towards end head municipal branch office firstly city centre front main post office building falsely introduced street vendor market inspector invited car pretext certain documents copied thereafter drove girl away karađorđeva street tried rape girl age romani origin resistance screams crying ultimately thwarted assailant underaged girl warned tell anyone happened give telephone number next day head municipal branch office called arranged meet met arrested also detained period fortyeight hours brought investigating assailant charged false impersonation unlawful deprivation liberty attempted rape commenced shall course conclusion local otherwise prompt comes informing even much lesser offences simply kept silent incident press also received information investigating prosecution service otherwise also cooperative respect providing information concerning activities magazine indirectly found horrific ordeal suffered underaged fellow citizen provided information following receipt written request asking confirm deny details learnt others nongovernmental organisations focused romani rights issues also stayed quiet underaged street vendor probably priority rich donors city administration likewise nothing respect official remain silent uncomfortable questions soon answered power keep quiet attempted rape concerned romani girl anyone city administration intervene cover shameful incident idea thereby buy time make possible head municipal branch office strike deal gypsies paid withdraw attempted rape lastly importantly whose interest protect bully getting salary paid municipal budget free time attempting rape underaged fellow citizens long questions remain unanswered power city kragujevac unable remove shame regarding incident date svetlost published another regarding alleged incident titled false inspector near kragujevac attempted rape underaged girl lažni inspektor kod kragujevca pokušao siluje maloletnicu piece written journalist employed svetlost far relevant reads head municipal branch office village near kragujevac brought investigating kragujevac first instance year suspicion committed offences unlawful deprivation liberty performing illicit sexual acts underaged girl confirmed svetlost lodged underaged girl together mother selling year front main post office building kragujevac minor domestic supplies explored allegations fortyeight hours detention brought investigating despite incident taken place late issue usual press release received request regard lodged underaged girl states around introduced market inspector told could freely sell merchandise front post office building charge area one hour later returned car front post office building invited girl approach vehicle girl came near told enter car sign document locked front passenger door drove away scene explained girl certain documents copied started touching leg according girl told false inspector could leave mother asked calm parking car karađorđeva street started touching kissing neck girl started screaming turned music loudly vehicle tore buttons trousers clip bra girl punched car windows told calm would touch drove away nikola pašić street proposed coffee together told tell anyone happened one day later called girl phone mother answered arrangement made meeting take place front post office building instead met girl met taken station noted time publication two articles also editorinchief svetlost first second articles published pages news magazine respectively following preliminary investigation charged kragujevac prosecutors office osnovno javno tužilaštvo kragujevcu connection abovedescribed incident charges alleged committed crimes unlawful deprivation liberty protivpravno lišenje slobode illicit performance sexual acts nedozvoljene polne radnje kragujevac first instance osnovni sud kragujevcu thereafter heard alleged victim well number witnesses furthermore took account statements given documentation obtained course preliminary meantime alleged victim provided well mothers courtcertified statements wherein fully recanted earlier accusing crimes question kragujevac first instance acquitted charges following remittal acquitted charges upheld kragujevac appeals apelacioni sud kragujevcu second instance thereby became final civil lodged civil defamation kragujevac high viši sud kragujevcu svetlost regarding two published articles ruled partly favour ordered svetlost pay jointly total serbian dinars rsd well statutory interest date account mental anguish suffered consequence breach honour reputation plus rsd furthermore ordered said two respondents publish without comment delay news magazine kragujevac high explained regards first specific reference thereof inter alia author stated committed crimes unlawful deprivation liberty false impersonation attempted rape despite latter still pending thereby breaching presumed innocent furthermore included untrue statement reported committed crime attempted rape even though known pressed charges particular respect second prepared specifically regards paragraphs thereof rejected plaintiffs noting piece written accurately based information provided lastly noted existence statement reiterated bearing present since given publication articles question kragujevac appeals partly amended delivered first instance ordered svetlost pay jointly total rsd approximately euros eur time account mental anguish suffered consequence breach honour reputation well statutory interest plus rsd approximately eur time obligation part respondents publish upheld reasoning essentially along lines offered kragujevac high kragujevac appeals nevertheless held inter alia award rsd excessive given existing interest informed incident question albeit appropriate manner also incorrectly stated title piece despite accurate text attempted rape underaged girl could considered figure someone withstand criticism since merely employed head municipal branch office local official službenik teritorijalnoj jedinici lokalne samouprave rulings relied inter alia relevant provisions obligations act information act summarised paragraphs constitutional lodged constitutional ustavnu žalbu kragujevac appeals constitutional ustavni sud dismissed noted inter alia unlawful divulge information concerning ongoing even information accurate breach ones presumed innocent appropriate balance struck one hand protection reputation concerned civil hand done properly served constitutional enforcement lodged enforcement request predlog izvršenje kragujevac first instance regards civil judgments paragraphs kragujevac first instance issued enforcement rešenje izvršenju bailiff izvršitelj ordered pay within three days sums question noted inter alia fail comply entire property would subject enforcement izvršenje celokupnoj imovini according information provided since unemployed lacking movable assets relevance enforcement procedure also civil judgments question yet enforced however stated flat living family could yet seek enforcement property confirmed civil judgments issue remained unenforced relevant facts statement given kragujevac high part civil defamation recounted publication articles question called asked pieces published response offered opportunity deny allegations newsmagazines next issue refused offer wanted debate matter media lastly informed would instead bringing regard visited neuropsychiatrist allegedly consequence distress suffered due publication articles date also provided certificate attesting temporarily incapable working average gross net monthly salaries kragujevac rsd rsd approximately eur eur respectively relevant framework jurisprudence obligations act zakon obligacionim odnosima published official gazette socialist federal republic yugoslavia nos well official gazette federal republic yugoslavia articles inter alia anyone suffered mental anguish consequence breach honour reputation depending duration intensity said mental anguish sue financial compensation civil addition request forms redress capable affording adequate nonpecuniary satisfaction information act zakon javnom informisanju published official gazette republic serbia nos provided prior publication information regarding occurrence certain journalist responsible editor verify origin veracity comprehensiveness due diligence provided inter alia protection ones privacy limited holders state political positions information question relevance given functions rights persons limited proportion justified interest provided inter alia editorinchief media outlet status responsible editor outlet responsible editor specific edition column programme held responsible contents edited provided inter alia media outlet could pronounce anyone guilty absence final another rendered connection provided inter alia suffered pecuniary andor nonpecuniary harm consequence incorrect incomplete information published media outlet due publication information breach act entitled adequate compensation quite apart available redress provided inter alia editorinchief founder media outlet would able establish due diligence inaccuracy incompleteness information prior publication bear joint liability pecuniary andor nonpecuniary damage caused publication information question obligation example also applied harm caused inadmissible publication accurate information regarding ones private life concerned accusations involving commission act subsequently amended decisions rendered constitutional ultimately repealed replaced legislation adopted city kragujevac establishment competencies municipal branch offices odluka obrazovanju delokrugu rada mesnih kancelarija published official gazette city kragujevac viii provided inter alia municipal branch offices established purpose making easier citizens concerned benefit services local level provided inter alia municipal branch offices perform technical tasks keep official records issue official certificates well prepare reports statistics context rules internal organisation job classification issued kragujevac office local selfgovernment affairs pravilnik unutrašnjoj organizaciji sistematizaciji radnih mesta gradskoj upravi mesnu samoupravu opštu upravu kragujevac rules provided inter alia executive employees working municipal branch offices could engage activities keeping official records issuing various certificates preparing reports statistics dealing civil matters could also take responsibilities specific request municipal officials encyclopaedia pravna enciklopedija volume savremena administracija belgrade needed necessary municipalities set local branch offices carry various functions effectively branch offices established bases municipal regulations statutima opština remit defined decisions adopted municipal assemblies odlukama opštinskih skupština heads local branch offices shall municipal employees appointed either municipal assemblies bodies authorised municipal assemblies,,,
1,born lives weinheim campaigner abortion operates antiabortion website distributed leaflets immediate vicinity medical practice leaflets contained inter alia following text front page know full name address performs abortions unlawful according caselaw federal constitutional wussten sie schon dass abtreibungen durchführt die nach der rechtsprechung des bundesverfassungsgerichts rechtswidrig sind underneath following smaller type according international aggravated murder intentional bringingtodeath innocent sinngemӓβ aus den internationalen strafgesetzen mord ist das vorsӓtzliche tode bringen eines unschuldigen menschen back side folded leaflet contained following text aggravated murder beings auschwitz unlawful morally degraded state allowed aggravated murder innocent people make subject liability die ermordung der menschen auschwitz war rechtswidrig aber der moralisch verkommene nsstaat hatte den mord den unschuldigen menschen erlaubt und nicht unter strafe gestellt quoted parts federal constitutional leading bverf regard abortion statement christoph wilhelm hufeland personal physician goethe schiller also cited conflicts pregnancy act asked readers make use influence performing assisting abortions letter requested sign declaration cease desist refused published following statement website full name carrying abortions publicly shows agrees abortions stand opinion instead considers leaflet campaign slander threatens interim injunction already given mandate lodge defamationslander ask unprincipled characterless wenn mit der durchführung von abtreibungen öffentlich bekundet dass für abtreibungen ist dann sollte auch dazu stehen stattdessen sieht der flugblatt verteilaktion eine rufmordkampagne droht mit einer einstweiligen verfügung und hat bereits seinem rechtsanwalt die vollmacht gegeben eine strafanzeige wegen beleidigung verleumdung erwirken wir fragen uns ist stand und charakterlos subsequently applied karlsruhe regional civil injunction ordering internet plaintiff performed unlawful abortions disseminate leaflets containing name assertion unlawful abortions performed medical practice also lodged nonpecuniary damages amount euros eur pretrial fees date oral karlsruhe regional distributed second leaflet directly front practice among places deposited second leaflet mentioned name letterboxes immediate vicinity latters practice following front side leaflet near unlawful abortions silent aggravated murder children ihrer nähe rechtswidrige abtreibungen und sie schweigen zum mord unseren kindern emphases original back folded leaflet contained following text prenatal infanticides meanwhile taken proportions bring mind new holocaust diese vorgeburtlichen kindstötungen haben mittlerweile ausmaße angenommen welche einen neuen holocaust erinnern emphases original farther leaflet simply unable understand medical personnel doctors supposed help save lives stoop take part aggravated murder noch weniger kann ich verstehen dass mediziner und ärzte welche helfen und leben retten sollen sich fürs morden hergeben karlsruhe regional granted requested injunction ordered desist asserting publicly writing orally internet well leaflets plaintiff performed unlawful abortions medical practice addition regional awarded compensation pecuniary damage requested plaintiff eur dismissed respect nonpecuniary damage held applicants statements protected contributed debate moreover classified statements information abortions unlawful line constitutional incorrect however conjunction whole leaflet statements pillory effect amounted serious interference personality rights justified applicants came conclusion based facts singled mentioning name distributing leaflets vicinity practice quoted federal constitutional parts omitted parts stated doctors subject liability implied defining aggravated murder committed associated holocaust nonetheless regard nonpecuniary damage concluded even though attacks reputation grave enough justify injunction sufficiently serious justify nonpecuniary damage appealed regional additionally expanded action include second leaflet subsequently became subject matter karlsruhe karlsruhe confirmed reasoning regional essence dismissed appeals however partly modified regional concerning precise wording requested injunction ordered desist asserting performed unlawful abortions medical practice asserting direct connection aggravated murder intentional bringingtodeath innocent ordered desist asserting performed unlawful abortions causing infanticide outset emphasised applicants view abortions subject liability compatible higherranking fell within applicants however also noted wording applicants statements showed labelled abortions performed plaintiff aggravated murder could tolerated neither statements considered statements considered value judgments view created unacceptable pillory effect singling plaintiff given reason regard noted involved debate abortions way regard second leaflet held even though mentioned name referred distributed front medical practice deposited letterboxes vicinity similarly first leaflet negligible part readers would understood leaflet professional activities constituted aggravated murder however even understood nonlegal sense leaflet made understood conducted illegal punishable abortions since clarified criticising abortions according caselaw federal constitutional unlawful subject liability exceeded limits justifiable criticism damages upheld firstinstance also grant leave points federal refused request aid denial leave points grounds applicants intended points lacked sufficient prospect success federal constitutional refused admit lodged adjudication inadmissible without providing reasons relevant domestic practice relevant domestic practice set annen,,,
